Produto,Preço,Juros,Estrelas
Cadeira de Escritório Secretária Base Cromada com Rodinha Fortt Roma Preta - CSF06-P,"229,00",Mais de 400 compras no mês passado,4
Cadeira de Escritório Presidente Vegas Relax Duoffice DU300,"599,90","em até 4x de R$ 57,25 sem juros",420
Cadeira de Escritório Giratória Diretor Executive Três Comfort Preta,"247,88",De:,1.443
Moob Cadeira de Escritório Presidente Chicago Giratória Com Sistema Relax Preta,"499,90","em até 10x de R$ 59,99 sem juros",30
Cadeira de Escritório Secretária Base Cromada com Rodinha Fortt Lisboa Preta - CSF02-P,"252,40",Compre produtos de marcas de pequenos negócios vendidos na loja da Amazon. Saiba mais sobre o compromisso da Amazon para impulsionar o sucesso dos pequenos negócios que vendem na Amazon.com.br.,1.094
"Cadeira Presidente Giratória, Mymax, 25.008922, Preto","426,00",Mais de 1 mil compras no mês passado,3.741
Cadeira Para Escritório Presidente Giratória Ergonômica ANM312 P,"949,00","em até 4x de R$ 61,97 sem juros",1.195
Cadeira de Escritorio Presidente Giratoria Confortavel Fox,"689,90",Mais opções de compra,2
Cadeira Para Escritório Presidente Giratória Ergonômica ANM 321D,"499,99","em até 9x de R$ 55,58 sem juros",2
Cadeira Escritório Diretor Tela Mesh Com Encosto De Cabeça,"274,90",Mais de 500 compras no mês passado,304
Cadeira de Escritório Presidente Vegas Duoffice DU300,"599,90",De:,14
Moob Cadeira de Escritório Presidente Filadélfia Giratória Com Sistema Relax Preta,"449,90","em até 5x de R$ 50,48 sem juros",6.066
Cadeira Gamer Profissional TGC12 Preta ThunderX3.,"1.140,00",Mais opções de compra,387
Cadeira Executiva Madrid Giratória Regulagem de Altura a Gas Telada Preta,"248,90",Mais de 400 compras no mês passado,7
YAMASORO Cadeira de Escritorio Presidente de Luxo em Couro Giratória Regulagem de Altura Cadeira Escritório com Apoio de Cabeça-Azul,"1.369,99","em até 8x de R$ 53,25 sem juros",224
Cadeira de Escritório Secretária Base Preta com Rodinha Fortt Milão Preta - CSF07-P,"229,00",Mais opções de compra,281
Cadeira Escritório Brun Charles Eames Diretor Giratória Aço,"547,20",Mais de 600 compras no mês passado,118
Cadeira De Escritório Royale Preto e Branco,"599,90","em até 10x de R$ 94,90 sem juros",219
Cadeira Presidente Ergonômica Giratória Preta 3307,"429,00",Mais opções de compra,203
Cadeira Escritório Presidente Alta Giratória Eames Off White,"559,00",Mais de 100 compras no mês passado,207
Moob Cadeira de Escritório Estofada Eames Giratória Preta,"299,90","em até 10x de R$ 68,99 sem juros",198
Cadeira de Escritorio Esteirinha Mesh Ergonomica Giratoria,"249,90",Mais opções de compra,1
Cadeira De Escritorio Presidente Ergonomica Apoio Para Pés (Preto),"939,90","em até 9x de R$ 55,59 sem juros",2
Cadeira de Escritório Executiva Moob Viena Giratória Com Regulagem de Altura a Gás Telada Preta,"299,77","em até 5x de R$ 54,98 sem juros",1.945
Kit 2 Cadeiras Escritório Diretor Tela Mesh Encosto De Cabeça,"484,90",De:,27
Cadeira Presidente de Escritorio Giratoria FoxOffice C161W PU - Branca,"491,21","em até 10x de R$ 59,99 sem juros",18
Cadeira de Escritório Secretária Giratória Fitz Rosa Turquia,"342,55",Compre produtos de marcas de pequenos negócios vendidos na loja da Amazon. Saiba mais sobre o compromisso da Amazon para impulsionar o sucesso dos pequenos negócios que vendem na Amazon.com.br.,23
CADEIRA GAMER MAD RACER STI MASTER PRETO - MADSTIMSPT - PCYES,"715,00","em até 8x de R$ 56,29 sem juros",56
Cadeira Xtreme Gamers Cinesis Giratória Reclinável Altura Ajustável Preta e Branca,"594,96",Mais opções de compra,5
Cadeira Escritório Presidente Nice Giratória Regulagem de Altura a Gás Revestimento,"699,90",Mais de 50 compras no mês passado,19
Cadeira de Escritório Confort Diretor - Kza Bela,"239,90","em até 4x de R$ 62,24 sem juros",3
Cadeira De Escritorio Ergonomica Presidente Apoio Para Pés Cor:Rosa,"869,90","em até 10x de R$ 137,08 sem juros",34
Cadeira Para Escritório Presidente Racer-X Modelo Rush Reclinável Cinza,"756,90",Compre produtos de marcas de pequenos negócios vendidos na loja da Amazon. Saiba mais sobre o compromisso da Amazon para impulsionar o sucesso dos pequenos negócios que vendem na Amazon.com.br.,235
Cadeira de Escritório Secretária Giratória com braço regulável Gatilho Tecido — Qualiflex (Couro),"345,90","em até 4x de R$ 57,25 sem juros",2
Cadeira De Escritório Rohden Home & Office Diretor ErgoMesh Preta - RHO-330,"699,00",Mais de 50 compras no mês passado,2
Cadeira Escritório Diretor Tela Mesh Com Encosto De Cabeça,"384,90","em até 10x de R$ 54,72 sem juros",56
Cadeira Para Escritório Presidente Giratória Ergonômica ANM312 P,"900,00","em até 10x de R$ 59,99 sem juros",10
Cadeira Escritório Giratória Wave Com Encosto Em Tela Preta/PPPR Base Cromada,"254,36",Mais de 100 compras no mês passado,8
Cadeira De Escritório Três Confort Executive Preta e Cromada,"215,00","em até 8x de R$ 53,66 sem juros",1.984
CADEIRA ESCRITÓRIO ERGONÔMICA MAGNUS BLACK – PCEEMAGPT - PCYES,"1.020,55","em até 10x de R$ 55,90 sem juros",81
Cadeira de Escritorio Elements Astra Verde/Branca,"999,00",De:,11
Cadeira de Escritorio Begonia Tela Mesh Ergonomica Giratoria,"269,89","em até 5x de R$ 59,98 sem juros",20
