Produto,Preço
Cadeira de Escritório Secretária Base Cromada com Rodinha Fortt Roma Preta - CSF06-P,"229,00"
Cadeira de Escritório Presidente Vegas Relax Duoffice DU300,"599,90"
Cadeira de Escritório Giratória Diretor Executive Três Comfort Preta,"247,88"
Moob Cadeira de Escritório Presidente Chicago Giratória Com Sistema Relax Preta,"499,90"
Cadeira de Escritório Secretária Base Cromada com Rodinha Fortt Lisboa Preta - CSF02-P,"252,40"
"Cadeira Presidente Giratória, Mymax, 25.008922, Preto","426,00"
Cadeira Para Escritório Presidente Giratória Ergonômica ANM312 P,"949,00"
Cadeira de Escritorio Presidente Giratoria Confortavel Fox,"689,90"
Cadeira Escritório Diretor Tela Mesh Com Encosto De Cabeça,"274,90"
Cadeira Para Escritório Presidente Giratória Ergonômica ANM 321D,"499,99"
Cadeira Gamer Profissional TGC12 Preta ThunderX3.,"1.140,00"
Cadeira Executiva Madrid Giratória Regulagem de Altura a Gas Telada Preta,"248,90"
Moob Cadeira de Escritório Presidente Filadélfia Giratória Com Sistema Relax Preta,"449,90"
Cadeira de Escritório Secretária Base Preta com Rodinha Fortt Milão Preta - CSF07-P,"229,00"
Cadeira de Escritório Presidente Vegas Duoffice DU300,"599,90"
YAMASORO Cadeira de Escritorio Presidente de Luxo em Couro Giratória Regulagem de Altura Cadeira Escritório com Apoio de Cabeça-Azul,"1.369,99"
Cadeira Escritório Brun Charles Eames Diretor Giratória Aço,"547,20"
Cadeira De Escritório Royale Preto e Branco,"599,90"
Cadeira Presidente Ergonômica Giratória Preta 3307,"429,00"
Cadeira Escritório Presidente Alta Giratória Eames Off White,"559,00"
Moob Cadeira de Escritório Estofada Eames Giratória Preta,"299,90"
Cadeira de Escritorio Esteirinha Mesh Ergonomica Giratoria,"249,90"
Cadeira De Escritorio Presidente Ergonomica Apoio Para Pés (Preto),"939,90"
Cadeira de Escritório Executiva Moob Viena Giratória Com Regulagem de Altura a Gás Telada Preta,"299,77"
Kit 2 Cadeiras Escritório Diretor Tela Mesh Encosto De Cabeça,"484,90"
Cadeira Presidente de Escritorio Giratoria FoxOffice C161W PU - Branca,"491,21"
Cadeira de Escritório Secretária Giratória Fitz Rosa Turquia,"342,55"
Cadeira Para Escritório Presidente Racer-X Modelo Rush Reclinável Cinza,"756,90"
CADEIRA GAMER MAD RACER STI MASTER PRETO - MADSTIMSPT - PCYES,"715,00"
Cadeira Xtreme Gamers Cinesis Giratória Reclinável Altura Ajustável Preta e Branca,"594,96"
Cadeira de Escritorio Elements Astra Verde/Branca,"999,00"
Cadeira de Escritório Confort Diretor - Kza Bela,"239,90"
Cadeira De Escritorio Ergonomica Presidente Apoio Para Pés Cor:Rosa,"869,90"
Cadeira Escritório Presidente Nice Giratória Regulagem de Altura a Gás Revestimento,"699,90"
Cadeira de Escritório Secretária Giratória com braço regulável Gatilho Tecido — Qualiflex (Couro),"345,90"
Cadeira De Escritório Rohden Home & Office Diretor ErgoMesh Preta - RHO-330,"699,00"
Cadeira Para Escritório Presidente Giratória Ergonômica ANM312 P,"900,00"
Cadeira Escritório Diretor Tela Mesh Com Encosto De Cabeça,"384,90"
Cadeira Escritório Giratória Wave Com Encosto Em Tela Preta/PPPR Base Cromada,"254,36"
Cadeira De Escritório Três Confort Executive Preta e Cromada,"215,00"
CADEIRA ESCRITÓRIO ERGONÔMICA MAGNUS BLACK – PCEEMAGPT - PCYES,"1.020,55"
Cadeira de Escritorio Begonia Tela Mesh Ergonomica Giratoria,"269,89"
Moob Cadeira de Escritório Diretor Firenze Giratória Com Regulagem de Altura a Gás Preta,"499,90"
"Cadeira Gamer TGT Heron, Preta e Azul, TGT-HR-BBU01","469,90"
Cadeira de Escritório Esteirinha Base Cromada com Rodinha Fortt Praga Marrom - CEF02-M,"479,00"
Cadeira Diretor Boston Giratória Regulagem de Altura a Gás Esteirinha Preto - MOOB,"549,90"
Cadeira de Escritorio Elements Astra cinza/branca,"1.629,90"
Cadeira de Escritorio Dublin Tela Mesh Ergonomica Giratoria,"369,90"
